{
  "$schema": "https://json-schema.org/draft/2020-12/schema",
  "title": "check-hints.json — how simulation observes the requirements it judges",
  "description": "A hint says how simulation observes requirements.json rows judged simulation and carrying no target: what is observed and against what rule. It names rows, never restates them; simulation reads each named row from requirements.json. check-crossrefs: every such row is named by at least one hint; every hint names only such rows; check_id is unique in this file.",
  "type": "array",
  "items": {
    "type": "object",
    "required": [
      "check_id",
      "requirements",
      "observable",
      "reference_rule"
    ],
    "additionalProperties": false,
    "properties": {
      "check_id": {
        "type": "string",
        "minLength": 1,
        "description": "Unique in this file. testpoints[].covers[] refers to it."
      },
      "requirements": {
        "type": "array",
        "minItems": 1,
        "items": {
          "type": "string",
          "minLength": 1
        },
        "description": "The requirements.json ids this check establishes."
      },
      "observable": {
        "type": "string",
        "minLength": 1,
        "description": "The top-boundary signal, port, or report observed; a cut-edge wire only where the boundary cannot distinguish, with the reason in reference_rule."
      },
      "reference_rule": {
        "type": "string",
        "minLength": 1,
        "description": "What the observable is judged against: a reference-model relation, a cycle relation, a tolerance."
      }
    }
  }
}
