[
  {
    "check_id": "CHK-SREG-01",
    "requirements": [
      "R-008"
    ],
    "observable": "`out1` (`mac00_in`)",
    "reference_rule": "out1[t] == in1[t-1]"
  },
  {
    "check_id": "CHK-SREG-02",
    "requirements": [
      "R-009"
    ],
    "observable": "`out2` (`mac10_in`)",
    "reference_rule": "out2[t] == in2[t-2]"
  },
  {
    "check_id": "CHK-SREG-03",
    "requirements": [
      "R-010"
    ],
    "observable": "`delay10`, `delay20`, `delay21`, `out1`, `out2`",
    "reference_rule": "on i_rstn==0: delay10==delay20==delay21==0 → out1==out2==0"
  },
  {
    "check_id": "CHK-SREG-04",
    "requirements": [
      "R-011"
    ],
    "observable": "`out1` (`mac00_in`), `out2` (`mac10_in`)",
    "reference_rule": "for pair presented at t: out1 valid at t+1, out2 valid at t+2 (out1 leads out2 by 1)"
  }
]
