[
  {
    "check_id": "CHK-TOP-01",
    "requirements": [
      "R-021"
    ],
    "observable": "`mem[i_paddr]` (`mem[0]`/`mem[1]`/`mem[2]`/`mem[3]`) → MAC `i_weight`",
    "reference_rule": "on write_enb: mem[i_paddr][t+1] == i_pwdata[t]"
  },
  {
    "check_id": "CHK-TOP-02",
    "requirements": [
      "R-022"
    ],
    "observable": "`o_prdata`, `fifo_result.i_rd` (`result_fifo_o_data`)",
    "reference_rule": "read_enb=1 → o_prdata==fifo_result.o_data & i_rd advances rd_addr; read_enb=0 → o_prdata==0"
  },
  {
    "check_id": "CHK-TOP-03",
    "requirements": [
      "R-023"
    ],
    "observable": "`mem[0]`, `mem[1]`, `mem[2]`, `mem[3]`",
    "reference_rule": "i_paddr∈{0,1,2,3} maps to mem[0..3] = W00/W01/W10/W11"
  },
  {
    "check_id": "CHK-TOP-04",
    "requirements": [
      "R-024"
    ],
    "observable": "`counter`",
    "reference_rule": "start=1 → counter[t+1]==counter[t]+1; start=0 → counter[t+1]==0"
  },
  {
    "check_id": "CHK-TOP-05",
    "requirements": [
      "R-025"
    ],
    "observable": "`fifo_en` → `fifo_00.i_rd`, `fifo_01.i_rd`",
    "reference_rule": "fifo_en == (start & (counter<2)); high at counter 0,1 only"
  },
  {
    "check_id": "CHK-TOP-06",
    "requirements": [
      "R-026"
    ],
    "observable": "`result_fifo_wr` → `fifo_result.i_wr`",
    "reference_rule": "result_fifo_wr==1 iff counter∈{2,3,4,5}"
  },
  {
    "check_id": "CHK-TOP-07",
    "requirements": [
      "R-027"
    ],
    "observable": "`result_fifo_i_data`, `out1`, `out2`",
    "reference_rule": "counter∈{2,4}→out1; counter∈{3,5}→out2; else 0"
  },
  {
    "check_id": "CHK-TOP-08",
    "requirements": [
      "R-028"
    ],
    "observable": "`done`",
    "reference_rule": "done == (counter >= 5)"
  },
  {
    "check_id": "CHK-TOP-09",
    "requirements": [
      "R-029"
    ],
    "observable": "`out1`, `out2`, `result_fifo_i_data`",
    "reference_rule": "top-row pre_result==32'h0; out1==mac_10.o_result; out2==mac_11.o_result"
  },
  {
    "check_id": "CHK-TOP-10",
    "requirements": [
      "R-030"
    ],
    "observable": "`counter`, `done`",
    "reference_rule": "re-assert start → counter 0→5, done rises again; drop start mid-pass → counter→0, done==0"
  }
]
