[
  {
    "check_id": "CHK-MAC-01",
    "requirements": [
      "R-001"
    ],
    "observable": "`o_result` (`mac00_out`/`mac01_out`/`out1`/`out2`)",
    "reference_rule": "`o_result_next = (i_data * i_weight) + i_pre_result`, truncated/wrapped to 32 bits"
  },
  {
    "check_id": "CHK-MAC-02",
    "requirements": [
      "R-002"
    ],
    "observable": "`o_data_next` (`mac01_in`/`mac11_in`)",
    "reference_rule": "`o_data_next_next = i_data`"
  },
  {
    "check_id": "CHK-MAC-03",
    "requirements": [
      "R-003"
    ],
    "observable": "`o_result` MSBs",
    "reference_rule": "`o_result = ((i_data * i_weight) + i_pre_result) mod 2^32`"
  },
  {
    "check_id": "CHK-MAC-04",
    "requirements": [
      "R-004"
    ],
    "observable": "`mac00_out`/`mac01_out` with `32'h0` tie",
    "reference_rule": "for `mac_00`/`mac_01`: `o_result = (i_data * i_weight) + 0` (i_pre_result tied `32'h0`)"
  },
  {
    "check_id": "CHK-MAC-05",
    "requirements": [
      "R-005"
    ],
    "observable": "`out1` (`mac_10.o_result`), `out2` (`mac_11.o_result`)",
    "reference_rule": "`out1 = (mac10.i_data * mem[2]) + mac00_out`; `out2 = (mac11.i_data * mem[3]) + mac01_out`"
  },
  {
    "check_id": "CHK-MAC-06",
    "requirements": [
      "R-006"
    ],
    "observable": "`o_result` on overflow stimulus",
    "reference_rule": "result wraps modulo 2^32; no saturation, no error flag"
  },
  {
    "check_id": "CHK-MAC-07",
    "requirements": [
      "R-007"
    ],
    "observable": "`mac_01.o_data_next`, `mac_11.o_data_next` (no consumer)",
    "reference_rule": "output left dangling by design; not a connectivity error"
  },
  {
    "check_id": "CHK-SREG-01",
    "requirements": [
      "R-008"
    ],
    "observable": "`out1` (`mac00_in`)",
    "reference_rule": "out1[t] == in1[t-1]"
  },
  {
    "check_id": "CHK-SREG-02",
    "requirements": [
      "R-009"
    ],
    "observable": "`out2` (`mac10_in`)",
    "reference_rule": "out2[t] == in2[t-2]"
  },
  {
    "check_id": "CHK-SREG-03",
    "requirements": [
      "R-010"
    ],
    "observable": "`delay10`, `delay20`, `delay21`, `out1`, `out2`",
    "reference_rule": "on i_rstn==0: delay10==delay20==delay21==0 → out1==out2==0"
  },
  {
    "check_id": "CHK-SREG-04",
    "requirements": [
      "R-011"
    ],
    "observable": "`out1` (`mac00_in`), `out2` (`mac10_in`)",
    "reference_rule": "for pair presented at t: out1 valid at t+1, out2 valid at t+2 (out1 leads out2 by 1)"
  },
  {
    "check_id": "CHK-FIFO-01",
    "requirements": [
      "R-012"
    ],
    "observable": "`mem[wr_addr]`, `wr_addr`",
    "reference_rule": "FIFO write/order contract"
  },
  {
    "check_id": "CHK-FIFO-02",
    "requirements": [
      "R-013"
    ],
    "observable": "`rd_addr`",
    "reference_rule": "FIFO pop contract"
  },
  {
    "check_id": "CHK-FIFO-03",
    "requirements": [
      "R-014"
    ],
    "observable": "`o_data`",
    "reference_rule": "combinational read"
  },
  {
    "check_id": "CHK-FIFO-04",
    "requirements": [
      "R-015"
    ],
    "observable": "`o_empty`",
    "reference_rule": "empty-flag contract"
  },
  {
    "check_id": "CHK-FIFO-05",
    "requirements": [
      "R-016"
    ],
    "observable": "`o_full`",
    "reference_rule": "full-flag contract (one slot reserved)"
  },
  {
    "check_id": "CHK-FIFO-06",
    "requirements": [
      "R-017"
    ],
    "observable": "`mem`, `wr_addr`, `rd_addr`",
    "reference_rule": "reset contract"
  },
  {
    "check_id": "CHK-FIFO-07",
    "requirements": [
      "R-018"
    ],
    "observable": "`o_data` sequence",
    "reference_rule": "FIFO ordering"
  },
  {
    "check_id": "CHK-FIFO-08",
    "requirements": [
      "R-019"
    ],
    "observable": "`wr_addr`, `rd_addr`, `o_full`, `o_empty`",
    "reference_rule": "modulo-8 wrap contract"
  },
  {
    "check_id": "CHK-FIFO-09",
    "requirements": [
      "R-020"
    ],
    "observable": "`wr_addr`, `rd_addr`",
    "reference_rule": "back-pressure / underflow guard"
  },
  {
    "check_id": "CHK-TOP-01",
    "requirements": [
      "R-021"
    ],
    "observable": "`mem[i_paddr]` (`mem[0]`/`mem[1]`/`mem[2]`/`mem[3]`) → MAC `i_weight`",
    "reference_rule": "on write_enb: mem[i_paddr][t+1] == i_pwdata[t]"
  },
  {
    "check_id": "CHK-TOP-02",
    "requirements": [
      "R-022"
    ],
    "observable": "`o_prdata`, `fifo_result.i_rd` (`result_fifo_o_data`)",
    "reference_rule": "read_enb=1 → o_prdata==fifo_result.o_data & i_rd advances rd_addr; read_enb=0 → o_prdata==0"
  },
  {
    "check_id": "CHK-TOP-03",
    "requirements": [
      "R-023"
    ],
    "observable": "`mem[0]`, `mem[1]`, `mem[2]`, `mem[3]`",
    "reference_rule": "i_paddr∈{0,1,2,3} maps to mem[0..3] = W00/W01/W10/W11"
  },
  {
    "check_id": "CHK-TOP-04",
    "requirements": [
      "R-024"
    ],
    "observable": "`counter`",
    "reference_rule": "start=1 → counter[t+1]==counter[t]+1; start=0 → counter[t+1]==0"
  },
  {
    "check_id": "CHK-TOP-05",
    "requirements": [
      "R-025"
    ],
    "observable": "`fifo_en` → `fifo_00.i_rd`, `fifo_01.i_rd`",
    "reference_rule": "fifo_en == (start & (counter<2)); high at counter 0,1 only"
  },
  {
    "check_id": "CHK-TOP-06",
    "requirements": [
      "R-026"
    ],
    "observable": "`result_fifo_wr` → `fifo_result.i_wr`",
    "reference_rule": "result_fifo_wr==1 iff counter∈{2,3,4,5}"
  },
  {
    "check_id": "CHK-TOP-07",
    "requirements": [
      "R-027"
    ],
    "observable": "`result_fifo_i_data`, `out1`, `out2`",
    "reference_rule": "counter∈{2,4}→out1; counter∈{3,5}→out2; else 0"
  },
  {
    "check_id": "CHK-TOP-08",
    "requirements": [
      "R-028"
    ],
    "observable": "`done`",
    "reference_rule": "done == (counter >= 5)"
  },
  {
    "check_id": "CHK-TOP-09",
    "requirements": [
      "R-029"
    ],
    "observable": "`out1`, `out2`, `result_fifo_i_data`",
    "reference_rule": "top-row pre_result==32'h0; out1==mac_10.o_result; out2==mac_11.o_result"
  },
  {
    "check_id": "CHK-TOP-10",
    "requirements": [
      "R-030"
    ],
    "observable": "`counter`, `done`",
    "reference_rule": "re-assert start → counter 0→5, done rises again; drop start mid-pass → counter→0, done==0"
  }
]
