[
  {
    "check_id": "CHK-MAC-01",
    "requirements": [
      "R-001"
    ],
    "observable": "`o_result` (`mac00_out`/`mac01_out`/`out1`/`out2`)",
    "reference_rule": "`o_result_next = (i_data * i_weight) + i_pre_result`, truncated/wrapped to 32 bits"
  },
  {
    "check_id": "CHK-MAC-02",
    "requirements": [
      "R-002"
    ],
    "observable": "`o_data_next` (`mac01_in`/`mac11_in`)",
    "reference_rule": "`o_data_next_next = i_data`"
  },
  {
    "check_id": "CHK-MAC-03",
    "requirements": [
      "R-003"
    ],
    "observable": "`o_result` MSBs",
    "reference_rule": "`o_result = ((i_data * i_weight) + i_pre_result) mod 2^32`"
  },
  {
    "check_id": "CHK-MAC-04",
    "requirements": [
      "R-004"
    ],
    "observable": "`mac00_out`/`mac01_out` with `32'h0` tie",
    "reference_rule": "for `mac_00`/`mac_01`: `o_result = (i_data * i_weight) + 0` (i_pre_result tied `32'h0`)"
  },
  {
    "check_id": "CHK-MAC-05",
    "requirements": [
      "R-005"
    ],
    "observable": "`out1` (`mac_10.o_result`), `out2` (`mac_11.o_result`)",
    "reference_rule": "`out1 = (mac10.i_data * mem[2]) + mac00_out`; `out2 = (mac11.i_data * mem[3]) + mac01_out`"
  },
  {
    "check_id": "CHK-MAC-06",
    "requirements": [
      "R-006"
    ],
    "observable": "`o_result` on overflow stimulus",
    "reference_rule": "result wraps modulo 2^32; no saturation, no error flag"
  },
  {
    "check_id": "CHK-MAC-07",
    "requirements": [
      "R-007"
    ],
    "observable": "`mac_01.o_data_next`, `mac_11.o_data_next` (no consumer)",
    "reference_rule": "output left dangling by design; not a connectivity error"
  }
]
