[
  {
    "check_id": "CHK-FIFO-01",
    "requirements": [
      "R-012"
    ],
    "observable": "`mem[wr_addr]`, `wr_addr`",
    "reference_rule": "FIFO write/order contract"
  },
  {
    "check_id": "CHK-FIFO-02",
    "requirements": [
      "R-013"
    ],
    "observable": "`rd_addr`",
    "reference_rule": "FIFO pop contract"
  },
  {
    "check_id": "CHK-FIFO-03",
    "requirements": [
      "R-014"
    ],
    "observable": "`o_data`",
    "reference_rule": "combinational read"
  },
  {
    "check_id": "CHK-FIFO-04",
    "requirements": [
      "R-015"
    ],
    "observable": "`o_empty`",
    "reference_rule": "empty-flag contract"
  },
  {
    "check_id": "CHK-FIFO-05",
    "requirements": [
      "R-016"
    ],
    "observable": "`o_full`",
    "reference_rule": "full-flag contract (one slot reserved)"
  },
  {
    "check_id": "CHK-FIFO-06",
    "requirements": [
      "R-017"
    ],
    "observable": "`mem`, `wr_addr`, `rd_addr`",
    "reference_rule": "reset contract"
  },
  {
    "check_id": "CHK-FIFO-07",
    "requirements": [
      "R-018"
    ],
    "observable": "`o_data` sequence",
    "reference_rule": "FIFO ordering"
  },
  {
    "check_id": "CHK-FIFO-08",
    "requirements": [
      "R-019"
    ],
    "observable": "`wr_addr`, `rd_addr`, `o_full`, `o_empty`",
    "reference_rule": "modulo-8 wrap contract"
  },
  {
    "check_id": "CHK-FIFO-09",
    "requirements": [
      "R-020"
    ],
    "observable": "`wr_addr`, `rd_addr`",
    "reference_rule": "back-pressure / underflow guard"
  }
]
